{
  "$schema": "http://json-schema.org/draft-07/schema#",
  "title": "Labware",
  "type": "object",
  "properties": {
    "ordering": {
      "type": "array",
      "items": {
        "type": "array",
        "items": {"type": "string"}
      }
    },
    "brand": {
      "type": "object",
      "properties": {
        "brand": {"type": "string"},
        "brandId": {
          "type": "array",
          "items": {"type": "string"}
        }
      }
    },
    "metadata": {
      "type": "object",
      "properties": {
        "displayName": {"type": "string"},
        "displayCategory": {"type": "string"},
        "displayVolumeUnits": {"type": "string"},
        "tags": {"type": "array", "items": {"type": "string"}}
      }
    },
    "dimensions": {
      "type": "object",
      "properties": {
        "xDimension": {"type": "number"},
        "yDimension": {"type": "number"},
        "zDimension": {"type": "number"}
      }
    },
    "wells": {
      "type": "object",
      "additionalProperties": {
        "type": "object",
        "properties": {
          "depth": {"type": "number"},
          "totalLiquidVolume": {"type": "number"},
          "shape": {"type": "string"},
          "diameter": {"type": "number"},
          "xDimension": {"type": "number"},
          "yDimension": {"type": "number"},
          "x": {"type": "number"},
          "y": {"type": "number"},
          "z": {"type": "number"}
        }
      }
    },
    "groups": {
      "type": "array",
      "items": {
        "type": "object",
        "properties": {
          "metadata": {
            "type": "object",
            "properties": {
              "wellBottomShape": {"type": "string"}
            }
          },
          "wells": {
            "type": "array",
            "items": {"type": "string"}
          }
        }
      }
    },
    "parameters": {
      "type": "object",
      "properties": {
        "format": {"type": "string"},
        "quirks": {"type": "array", "items": {"type": "string"}},
        "isMagneticModuleCompatible": {"type": "boolean"},
        "loadName": {"type": "string"}
      }
    },
    "namespace": {"type": "string"},
    "version": {"type": "number"},
    "schemaVersion": {"type": "number"},
    "cornerOffsetFromSlot": {
      "type": "object",
      "properties": {
        "x": {"type": "number"},
        "y": {"type": "number"},
        "z": {"type": "number"}
      }
    }
  },
  "required": [
    "ordering",
    "brand",
    "metadata",
    "dimensions",
    "wells",
    "groups",
    "parameters",
    "namespace",
    "version",
    "schemaVersion",
    "cornerOffsetFromSlot"
  ]
}
