{
    "ordering": [
        [
            "A1",
            "B1",
            "C1"
        ],
        [
            "A2",
            "B2",
            "C2"
        ],
        [
            "A3",
            "B3",
            "C3"
        ],
        [
            "A4",
            "B4",
            "C4"
        ],
        [
            "A5",
            "B5",
            "C5"
        ]
    ],
    "brand": {
        "brand": "Sargent",
        "brandId": [
            "Jehad"
        ]
    },
    "metadata": {
        "displayName": "Sargent 15 Reservoir 5750 µL",
        "displayCategory": "reservoir",
        "displayVolumeUnits": "µL",
        "tags": []
    },
    "dimensions": {
        "xDimension": 127,
        "yDimension": 85,
        "zDimension": 38
    },
    "wells": {
        "A1": {
            "depth": 21,
            "totalLiquidVolume": 5750,
            "shape": "circular",
            "diameter": 19,
            "x": 22.8,
            "y": 63.5,
            "z": 17
        },
        "B1": {
            "depth": 21,
            "totalLiquidVolume": 5750,
            "shape": "circular",
            "diameter": 19,
            "x": 22.8,
            "y": 43.5,
            "z": 17
        },
        "C1": {
            "depth": 21,
            "totalLiquidVolume": 5750,
            "shape": "circular",
            "diameter": 19,
            "x": 22.8,
            "y": 23.5,
            "z": 17
        },
        "A2": {
            "depth": 21,
            "totalLiquidVolume": 5750,
            "shape": "circular",
            "diameter": 19,
            "x": 42.8,
            "y": 63.5,
            "z": 17
        },
        "B2": {
            "depth": 21,
            "totalLiquidVolume": 5750,
            "shape": "circular",
            "diameter": 19,
            "x": 42.8,
            "y": 43.5,
            "z": 17
        },
        "C2": {
            "depth": 21,
            "totalLiquidVolume": 5750,
            "shape": "circular",
            "diameter": 19,
            "x": 42.8,
            "y": 23.5,
            "z": 17
        },
        "A3": {
            "depth": 21,
            "totalLiquidVolume": 5750,
            "shape": "circular",
            "diameter": 19,
            "x": 62.8,
            "y": 63.5,
            "z": 17
        },
        "B3": {
            "depth": 21,
            "totalLiquidVolume": 5750,
            "shape": "circular",
            "diameter": 19,
            "x": 62.8,
            "y": 43.5,
            "z": 17
        },
        "C3": {
            "depth": 21,
            "totalLiquidVolume": 5750,
            "shape": "circular",
            "diameter": 19,
            "x": 62.8,
            "y": 23.5,
            "z": 17
        },
        "A4": {
            "depth": 21,
            "totalLiquidVolume": 5750,
            "shape": "circular",
            "diameter": 19,
            "x": 82.8,
            "y": 63.5,
            "z": 17
        },
        "B4": {
            "depth": 21,
            "totalLiquidVolume": 5750,
            "shape": "circular",
            "diameter": 19,
            "x": 82.8,
            "y": 43.5,
            "z": 17
        },
        "C4": {
            "depth": 21,
            "totalLiquidVolume": 5750,
            "shape": "circular",
            "diameter": 19,
            "x": 82.8,
            "y": 23.5,
            "z": 17
        },
        "A5": {
            "depth": 21,
            "totalLiquidVolume": 5750,
            "shape": "circular",
            "diameter": 19,
            "x": 102.8,
            "y": 63.5,
            "z": 17
        },
        "B5": {
            "depth": 21,
            "totalLiquidVolume": 5750,
            "shape": "circular",
            "diameter": 19,
            "x": 102.8,
            "y": 43.5,
            "z": 17
        },
        "C5": {
            "depth": 21,
            "totalLiquidVolume": 5750,
            "shape": "circular",
            "diameter": 19,
            "x": 102.8,
            "y": 23.5,
            "z": 17
        }
    },
    "groups": [
        {
            "metadata": {
                "wellBottomShape": "flat"
            },
            "wells": [
                "A1",
                "B1",
                "C1",
                "A2",
                "B2",
                "C2",
                "A3",
                "B3",
                "C3",
                "A4",
                "B4",
                "C4",
                "A5",
                "B5",
                "C5"
            ]
        }
    ],
    "parameters": {
        "format": "irregular",
        "quirks": [],
        "isMagneticModuleCompatible": false,
        "loadName": "sargent_15_reservoir_5750ul",
        "isTiprack": false
    },
    "namespace": "custom_beta",
    "version": 1,
    "schemaVersion": 2,
    "cornerOffsetFromSlot": {
        "x": 0,
        "y": 0,
        "z": 0
    }
}