{
    "ordering": [
        [
            "A1",
            "B1"
        ],
        [
            "A2",
            "B2"
        ]
    ],
    "brand": {
        "brand": "Nis",
        "brandId": [
            "tool",
            "electrode"
        ]
    },
    "metadata": {
        "displayName": "Nis 4 Tip Rack 1 µL",
        "displayCategory": "tipRack",
        "displayVolumeUnits": "µL",
        "tags": []
    },
    "dimensions": {
        "xDimension": 127,
        "yDimension": 85,
        "zDimension": 95
    },
    "wells": {
        "A1": {
            "depth": 89.35,
            "totalLiquidVolume": 1,
            "shape": "circular",
            "diameter": 8,
            "x": 31.69,
            "y": 64.26,
            "z": 5.65
        },
        "B1": {
            "depth": 89.35,
            "totalLiquidVolume": 1,
            "shape": "circular",
            "diameter": 8,
            "x": 31.69,
            "y": 20.75,
            "z": 5.65
        },
        "A2": {
            "depth": 89.35,
            "totalLiquidVolume": 1,
            "shape": "circular",
            "diameter": 8,
            "x": 95.25,
            "y": 64.26,
            "z": 5.65
        },
        "B2": {
            "depth": 89.35,
            "totalLiquidVolume": 1,
            "shape": "circular",
            "diameter": 8,
            "x": 95.25,
            "y": 20.75,
            "z": 5.65
        }
    },
    "groups": [
        {
            "metadata": {},
            "wells": [
                "A1",
                "B1",
                "A2",
                "B2"
            ]
        }
    ],
    "parameters": {
        "format": "irregular",
        "quirks": [],
        "tipLength": 89.35,
        "isMagneticModuleCompatible": false,
        "loadName": "nis_4_tiprack_1ul",
        "isTiprack": true
    },
    "namespace": "custom_beta",
    "version": 1,
    "schemaVersion": 2,
    "cornerOffsetFromSlot": {
        "x": 0,
        "y": 0,
        "z": 0
    }
}