{
    "ordering": [
        [
            "A1",
            "B1",
            "C1",
            "D1",
            "E1"
        ],
        [
            "A2",
            "B2",
            "C2",
            "D2",
            "E2"
        ],
        [
            "A3",
            "B3",
            "C3",
            "D3",
            "E3"
        ],
        [
            "A4",
            "B4",
            "C4",
            "D4",
            "E4"
        ],
        [
            "A5",
            "B5",
            "C5",
            "D5",
            "E5"
        ]
    ],
    "brand": {
        "brand": "AUTODIAL",
        "brandId": [
            "Daniel"
        ]
    },
    "metadata": {
        "displayName": "AUTODIAL 25 Reservoir 4620 µL",
        "displayCategory": "reservoir",
        "displayVolumeUnits": "µL",
        "tags": []
    },
    "dimensions": {
        "xDimension": 127.75,
        "yDimension": 85.5,
        "zDimension": 51
    },
    "wells": {
        "A1": {
            "depth": 29.5,
            "totalLiquidVolume": 4620,
            "shape": "circular",
            "diameter": 14,
            "x": 34.38,
            "y": 72.25,
            "z": 21.5
        },
        "B1": {
            "depth": 29.5,
            "totalLiquidVolume": 4620,
            "shape": "circular",
            "diameter": 14,
            "x": 34.38,
            "y": 57.25,
            "z": 21.5
        },
        "C1": {
            "depth": 29.5,
            "totalLiquidVolume": 4620,
            "shape": "circular",
            "diameter": 14,
            "x": 34.38,
            "y": 42.25,
            "z": 21.5
        },
        "D1": {
            "depth": 29.5,
            "totalLiquidVolume": 4620,
            "shape": "circular",
            "diameter": 14,
            "x": 34.38,
            "y": 27.25,
            "z": 21.5
        },
        "E1": {
            "depth": 29.5,
            "totalLiquidVolume": 4620,
            "shape": "circular",
            "diameter": 14,
            "x": 34.38,
            "y": 12.25,
            "z": 21.5
        },
        "A2": {
            "depth": 29.5,
            "totalLiquidVolume": 4620,
            "shape": "circular",
            "diameter": 14,
            "x": 49.38,
            "y": 72.25,
            "z": 21.5
        },
        "B2": {
            "depth": 29.5,
            "totalLiquidVolume": 4620,
            "shape": "circular",
            "diameter": 14,
            "x": 49.38,
            "y": 57.25,
            "z": 21.5
        },
        "C2": {
            "depth": 29.5,
            "totalLiquidVolume": 4620,
            "shape": "circular",
            "diameter": 14,
            "x": 49.38,
            "y": 42.25,
            "z": 21.5
        },
        "D2": {
            "depth": 29.5,
            "totalLiquidVolume": 4620,
            "shape": "circular",
            "diameter": 14,
            "x": 49.38,
            "y": 27.25,
            "z": 21.5
        },
        "E2": {
            "depth": 29.5,
            "totalLiquidVolume": 4620,
            "shape": "circular",
            "diameter": 14,
            "x": 49.38,
            "y": 12.25,
            "z": 21.5
        },
        "A3": {
            "depth": 29.5,
            "totalLiquidVolume": 4620,
            "shape": "circular",
            "diameter": 14,
            "x": 64.38,
            "y": 72.25,
            "z": 21.5
        },
        "B3": {
            "depth": 29.5,
            "totalLiquidVolume": 4620,
            "shape": "circular",
            "diameter": 14,
            "x": 64.38,
            "y": 57.25,
            "z": 21.5
        },
        "C3": {
            "depth": 29.5,
            "totalLiquidVolume": 4620,
            "shape": "circular",
            "diameter": 14,
            "x": 64.38,
            "y": 42.25,
            "z": 21.5
        },
        "D3": {
            "depth": 29.5,
            "totalLiquidVolume": 4620,
            "shape": "circular",
            "diameter": 14,
            "x": 64.38,
            "y": 27.25,
            "z": 21.5
        },
        "E3": {
            "depth": 29.5,
            "totalLiquidVolume": 4620,
            "shape": "circular",
            "diameter": 14,
            "x": 64.38,
            "y": 12.25,
            "z": 21.5
        },
        "A4": {
            "depth": 29.5,
            "totalLiquidVolume": 4620,
            "shape": "circular",
            "diameter": 14,
            "x": 79.38,
            "y": 72.25,
            "z": 21.5
        },
        "B4": {
            "depth": 29.5,
            "totalLiquidVolume": 4620,
            "shape": "circular",
            "diameter": 14,
            "x": 79.38,
            "y": 57.25,
            "z": 21.5
        },
        "C4": {
            "depth": 29.5,
            "totalLiquidVolume": 4620,
            "shape": "circular",
            "diameter": 14,
            "x": 79.38,
            "y": 42.25,
            "z": 21.5
        },
        "D4": {
            "depth": 29.5,
            "totalLiquidVolume": 4620,
            "shape": "circular",
            "diameter": 14,
            "x": 79.38,
            "y": 27.25,
            "z": 21.5
        },
        "E4": {
            "depth": 29.5,
            "totalLiquidVolume": 4620,
            "shape": "circular",
            "diameter": 14,
            "x": 79.38,
            "y": 12.25,
            "z": 21.5
        },
        "A5": {
            "depth": 29.5,
            "totalLiquidVolume": 4620,
            "shape": "circular",
            "diameter": 14,
            "x": 94.38,
            "y": 72.25,
            "z": 21.5
        },
        "B5": {
            "depth": 29.5,
            "totalLiquidVolume": 4620,
            "shape": "circular",
            "diameter": 14,
            "x": 94.38,
            "y": 57.25,
            "z": 21.5
        },
        "C5": {
            "depth": 29.5,
            "totalLiquidVolume": 4620,
            "shape": "circular",
            "diameter": 14,
            "x": 94.38,
            "y": 42.25,
            "z": 21.5
        },
        "D5": {
            "depth": 29.5,
            "totalLiquidVolume": 4620,
            "shape": "circular",
            "diameter": 14,
            "x": 94.38,
            "y": 27.25,
            "z": 21.5
        },
        "E5": {
            "depth": 29.5,
            "totalLiquidVolume": 4620,
            "shape": "circular",
            "diameter": 14,
            "x": 94.38,
            "y": 12.25,
            "z": 21.5
        }
    },
    "groups": [
        {
            "metadata": {
                "wellBottomShape": "flat"
            },
            "wells": [
                "A1",
                "B1",
                "C1",
                "D1",
                "E1",
                "A2",
                "B2",
                "C2",
                "D2",
                "E2",
                "A3",
                "B3",
                "C3",
                "D3",
                "E3",
                "A4",
                "B4",
                "C4",
                "D4",
                "E4",
                "A5",
                "B5",
                "C5",
                "D5",
                "E5"
            ]
        }
    ],
    "parameters": {
        "format": "irregular",
        "quirks": [],
        "isMagneticModuleCompatible": false,
        "loadName": "autodial_25_reservoir_4620ul",
        "isTiprack": false
    },
    "namespace": "custom_beta",
    "version": 1,
    "schemaVersion": 2,
    "cornerOffsetFromSlot": {
        "x": 0,
        "y": 0,
        "z": 0
    }
}