{
    "ordering": [
        [
            "A1",
            "B1"
        ],
        [
            "A2",
            "B2"
        ],
        [
            "A3",
            "B3"
        ],
        [
            "A4",
            "B4"
        ]
    ],
    "brand": {
        "brand": "Nis",
        "brandId": []
    },
    "metadata": {
        "displayName": "Nis 8 Reservoir 25000 µL",
        "displayCategory": "reservoir",
        "displayVolumeUnits": "µL",
        "tags": []
    },
    "dimensions": {
        "xDimension": 127.75,
        "yDimension": 85.5,
        "zDimension": 60.4
    },
    "wells": {
        "A1": {
            "depth": 57,
            "totalLiquidVolume": 25000,
            "shape": "circular",
            "diameter": 25,
            "x": 16.34,
            "y": 65.25,
            "z": 3.4
        },
        "B1": {
            "depth": 57,
            "totalLiquidVolume": 25000,
            "shape": "circular",
            "diameter": 25,
            "x": 16.34,
            "y": 20.25,
            "z": 3.4
        },
        "A2": {
            "depth": 57,
            "totalLiquidVolume": 25000,
            "shape": "circular",
            "diameter": 25,
            "x": 48.01,
            "y": 65.25,
            "z": 3.4
        },
        "B2": {
            "depth": 57,
            "totalLiquidVolume": 25000,
            "shape": "circular",
            "diameter": 25,
            "x": 48.01,
            "y": 20.25,
            "z": 3.4
        },
        "A3": {
            "depth": 57,
            "totalLiquidVolume": 25000,
            "shape": "circular",
            "diameter": 25,
            "x": 79.68,
            "y": 65.25,
            "z": 3.4
        },
        "B3": {
            "depth": 57,
            "totalLiquidVolume": 25000,
            "shape": "circular",
            "diameter": 25,
            "x": 79.68,
            "y": 20.25,
            "z": 3.4
        },
        "A4": {
            "depth": 57,
            "totalLiquidVolume": 25000,
            "shape": "circular",
            "diameter": 25,
            "x": 111.35,
            "y": 65.25,
            "z": 3.4
        },
        "B4": {
            "depth": 57,
            "totalLiquidVolume": 25000,
            "shape": "circular",
            "diameter": 25,
            "x": 111.35,
            "y": 20.25,
            "z": 3.4
        }
    },
    "groups": [
        {
            "metadata": {
                "wellBottomShape": "flat"
            },
            "wells": [
                "A1",
                "B1",
                "A2",
                "B2",
                "A3",
                "B3",
                "A4",
                "B4"
            ]
        }
    ],
    "parameters": {
        "format": "irregular",
        "quirks": [],
        "isMagneticModuleCompatible": false,
        "loadName": "nis_8_reservoir_25000ul",
        "isTiprack": false
    },
    "namespace": "custom_beta",
    "version": 1,
    "schemaVersion": 2,
    "cornerOffsetFromSlot": {
        "x": 0,
        "y": 0,
        "z": 0
    }
}