{
    "ordering": [
        [
            "A1"
        ],
        [
            "A2"
        ]
    ],
    "brand": {
        "brand": "Nis",
        "brandId": []
    },
    "metadata": {
        "displayName": "Nis 2 Well Plate 30000 µL",
        "displayCategory": "wellPlate",
        "displayVolumeUnits": "µL",
        "tags": []
    },
    "dimensions": {
        "xDimension": 127,
        "yDimension": 85,
        "zDimension": 104
    },
    "wells": {
        "A1": {
            "depth": 24,
            "totalLiquidVolume": 30000,
            "shape": "rectangular",
            "xDimension": 25,
            "yDimension": 59.7,
            "x": 35.3,
            "y": 42,
            "z": 80
        },
        "A2": {
            "depth": 24,
            "totalLiquidVolume": 30000,
            "shape": "rectangular",
            "xDimension": 25,
            "yDimension": 59.7,
            "x": 91.7,
            "y": 42,
            "z": 80
        }
    },
    "groups": [
        {
            "metadata": {
                "wellBottomShape": "flat"
            },
            "wells": [
                "A1",
                "A2"
            ]
        }
    ],
    "parameters": {
        "format": "irregular",
        "quirks": [],
        "isMagneticModuleCompatible": false,
        "loadName": "nis_2_wellplate_30000ul",
        "isTiprack": false
    },
    "namespace": "custom_beta",
    "version": 1,
    "schemaVersion": 2,
    "cornerOffsetFromSlot": {
        "x": 0,
        "y": 0,
        "z": 0
    }
}