{
    "ordering": [
        [
            "A1"
        ]
    ],
    "brand": {
        "brand": "TLG",
        "brandId": [
            "50mlBeaker"
        ]
    },
    "metadata": {
        "displayName": "TLG 1 Reservoir 50000 µL",
        "displayCategory": "reservoir",
        "displayVolumeUnits": "µL",
        "tags": []
    },
    "dimensions": {
        "xDimension": 127,
        "yDimension": 85,
        "zDimension": 58
    },
    "wells": {
        "A1": {
            "depth": 56,
            "totalLiquidVolume": 50000,
            "shape": "circular",
            "diameter": 38.6,
            "x": 63.5,
            "y": 42.5,
            "z": 2
        }
    },
    "groups": [
        {
            "metadata": {
                "wellBottomShape": "flat"
            },
            "wells": [
                "A1"
            ]
        }
    ],
    "parameters": {
        "format": "irregular",
        "quirks": [],
        "isMagneticModuleCompatible": false,
        "loadName": "tlg_1_reservoir_50000ul",
        "isTiprack": false
    },
    "namespace": "custom_beta",
    "version": 1,
    "schemaVersion": 2,
    "cornerOffsetFromSlot": {
        "x": 0,
        "y": 0,
        "z": 0
    }
}